{"bundle_version":1,"keys":[{"algorithm":"ed25519","fingerprint":"sha256:19e079c2aece68bae50eac9af779e3e0bb74e04edebaf43a2ad3d08e71dbb222","key_id":"release-2026-08","public_key":"+BsNUVc9B8eRcCOb+Sk8U23xY3sGswq6r6qW+4EPIgk=","status":"active"}],"kind":"atomlearn.trust-bundle","previous_bundle_version":null,"repository":"panjose/Atom-Learn","schema_version":1}
